{
  "$schema": "http://json-schema.org/draft-07/schema#",
  "title": "Claude Code plugin manifest",
  "type": "object",
  "required": ["name", "version", "description"],
  "properties": {
    "$schema": { "type": "string" },
    "name": { "type": "string", "pattern": "^[a-z0-9][a-z0-9-]*$" },
    "displayName": { "type": "string" },
    "version": { "type": "string", "pattern": "^[0-9]+\\.[0-9]+\\.[0-9]+(-[A-Za-z0-9.-]+)?$" },
    "description": { "type": "string", "minLength": 10 },
    "author": { "$ref": "#/definitions/party" },
    "homepage": { "type": "string", "format": "uri" },
    "repository": { "type": "string", "format": "uri" },
    "license": { "type": "string" },
    "keywords": { "type": "array", "items": { "type": "string" } },
    "skills": { "type": "string" },
    "mcpServers": { "type": "string" }
  },
  "definitions": {
    "party": {
      "type": "object",
      "required": ["name"],
      "properties": {
        "name": { "type": "string" },
        "email": { "type": "string", "format": "email" },
        "url": { "type": "string", "format": "uri" }
      }
    }
  }
}
